{
  "schema_version": "0.1",
  "job_id": "demo-job-001",
  "status": "completed",
  "execution": {"provider": "mock", "runner": "python", "exit_code": 0, "timed_out": false, "wall_ms": 12},
  "result": {"type": "text", "stdout": "2\\n", "stderr": "", "truncated": false},
  "provenance": {"request_sha256": "1111111111111111111111111111111111111111111111111111111111111111", "source_sha256": "2222222222222222222222222222222222222222222222222222222222222222"}
}
